question,optionA,optionB,optionC,optionD,correctAnswer,explanation
"Which difficulty most impedes investor efforts to address biodiversity depletion, given the complexity of measuring ecosystem impacts and intangible benefits?","The lack of investor interest","The complexity of measuring biodiversity impacts and outcomes","The absence of regulatory frameworks","The limited role of corporate governance",B,"Biodiversity loss is challenging to address because measuring its impacts and outcomes requires complex and site-specific data..."
"How does enhanced visibility into a company's supply chain reinforce ESG principles, particularly in identifying labor or environmental concerns?","It ensures compliance with all environmental regulations","It identifies risks such as labor violations and environmental degradation","It eliminates the need for stakeholder engagement","It focuses solely on financial performance",B,"Supply chain transparency helps investors identify ESG risks, such as labor violations..."
"Which effect do stranded assets exert on investment holdings, given their devaluation under shifting regulatory or technological landscapes?","They enhance portfolio returns","They expose investors to financial risks from devalued assets","They guarantee long-term growth","They focus exclusively on fossil fuels",B,"Stranded assets are assets that lose value or become obsolete..."
"Which central aim underlies the SBTi, guiding corporations to set emissions reduction goals anchored in climate science and the Paris Agreement?","To enforce penalties for non-compliance","To guide companies in setting emissions reduction targets aligned with climate science","To prioritize short-term economic growth","To exclude specific industries from ESG investments",B,"The SBTi provides companies with a framework for setting emissions reduction targets..."
"Which of the following best describes stranded assets in the context of ESG investing?","Assets that are undervalued in financial markets","Assets that lose value due to changes in policy, technology, or market demand","Assets that generate high financial returns with minimal ESG considerations","Assets with long-term growth potential in emerging markets",B,"Stranded assets are those that lose value or become obsolete due to shifts in policy, technology, or market preferences, particularly in the context of the energy transition. For example, coal-fired power plants or fossil fuel reserves may become stranded as governments impose stricter carbon regulations and demand for renewable energy increases. These assets pose significant financial risks for investors, emphasizing the importance of aligning portfolios with a low-carbon future."
"What is the significance of the Task Force on Climate-related Financial Disclosures (TCFD)?","It mandates carbon neutrality for all companies by 2030","It provides a framework for companies to disclose climate-related financial risks","It focuses exclusively on reporting social and governance factors","It penalizes companies with inadequate ESG practices",B,"The TCFD was established to enhance transparency around climate-related financial risks and opportunities. Its recommendations focus on four key areas: governance, strategy, risk management, and metrics and targets. By following the TCFD framework, companies can provide investors with decision-useful information about how they manage climate risks..."
"How do green bonds differ from conventional bonds?","They offer higher interest rates than conventional bonds","Their proceeds are exclusively allocated to environmentally beneficial projects","They carry no financial risk for investors","They are only available to institutional investors",B,"Green bonds are financial instruments designed to raise capital for projects that deliver environmental benefits, such as renewable energy, energy efficiency, or sustainable infrastructure..."
"What is a critical limitation of ESG ratings?","They provide excessive transparency to investors","They lack consistency across different rating agencies","They focus exclusively on financial performance","They disregard governance considerations",B,"A key limitation of ESG ratings is the lack of standardization across rating agencies..."
"Which of the following best exemplifies a just transition?","Accelerating the energy transition without regard for displaced workers","Ensuring that the transition to a low-carbon economy is equitable and inclusive","Prioritizing corporate profits over social equity during the energy transition","Restricting renewable energy investments to developed countries",B,"A just transition aims to ensure that the shift to a low-carbon economy is socially inclusive..."
"What distinguishes impact investing from traditional ESG investing?","Impact investing explicitly aims for measurable social or environmental outcomes","Impact investing avoids all high-risk investments","Impact investing focuses solely on governance factors","Impact investing disregards financial returns",A,"While traditional ESG investing considers environmental, social, and governance factors..."
"What is the role of stewardship in responsible investing?","Passive ownership of companies in ESG portfolios","Active engagement with companies to influence ESG practices","Avoidance of all ESG risks in investment decisions","Divestment from companies with low ESG ratings",B,"Stewardship involves active ownership, where investors engage with companies to encourage better ESG practices..."
"What is the role of shareholder activism in ESG?","Divesting from non-compliant companies","Pressuring companies to improve ESG practices through voting and resolutions","Avoiding all controversial sectors","Focusing only on financial returns",B,"Shareholder activism focuses on influencing corporate behavior through actions such as submitting shareholder proposals..."
"How do sustainability-linked bonds differ from green bonds?","They have fixed interest rates regardless of performance","They penalize companies for failing to meet specific ESG targets","They focus exclusively on renewable energy projects","They are only issued by governments",B,"Sustainability-linked bonds (SLBs) differ from green bonds in that their financial characteristics are tied..."
"What is the primary objective of the EU Taxonomy for Sustainable Activities?","To impose penalties on non-compliant companies","To establish a unified classification system for sustainable investments","To prioritize financial returns over ESG factors","To exclude emerging markets from ESG initiatives",B,"The EU Taxonomy provides a standardized framework to identify which economic activities qualify..."
"Why is biodiversity loss considered a systemic risk in ESG investing?","It has minimal impact on financial markets","It only affects emerging economies","It disrupts ecosystems critical for economic stability and human well-being","It is easily mitigated by technology alone",C,"Biodiversity loss is a systemic risk because it threatens the ecosystems that underpin economic activities..."
"What is the purpose of carbon offset programs?","To reduce emissions at the source","To compensate for emissions by funding equivalent carbon savings","To prioritize fossil fuel usage","To eliminate the need for renewable energy",B,"Carbon offset programs allow organizations to compensate for their greenhouse gas emissions..."
"What is the relationship between ESG integration and fiduciary duty?","They are unrelated concepts","ESG integration conflicts with fiduciary duty","ESG integration is increasingly seen as part of fiduciary duty","Fiduciary duty requires ignoring ESG considerations",C,"Fiduciary duty traditionally focused on financial returns, but modern interpretations increasingly recognize that ESG factors can have material impacts..."
"What are nature-based solutions in the context of ESG?","Technological interventions to replace natural systems","Strategies that use natural processes to address environmental challenges","Economic measures to phase out nature-related investments","Policies aimed solely at wildlife conservation",B,"Nature-based solutions leverage natural processes to address challenges such as climate change..."
"Why is social license to operate important for companies?","It ensures compliance with government regulations","It reflects public and stakeholder acceptance of a company's operations","It guarantees financial success in all industries","It eliminates the need for ESG reporting",B,"Social license to operate refers to the informal approval granted by communities..."
"What distinguishes greenwashing from genuine ESG efforts?","Greenwashing involves intentional misrepresentation of ESG practices","Greenwashing always leads to financial penalties","Greenwashing focuses exclusively on governance issues","Greenwashing is required to meet regulatory standards",A,"Greenwashing refers to the practice of misleading stakeholders..."
"What role do proxy voting policies play in ESG investing?","They dictate how fund managers vote on shareholder resolutions","They restrict companies from issuing ESG-related disclosures","They eliminate the need for active engagement with companies","They allow investors to divest from low-performing companies",A,"Proxy voting policies guide how fund managers vote on shareholder resolutions..."
"What is the main challenge in quantifying climate-related financial risks?","Limited investor interest in climate risks","The absence of regulatory requirements","The complexity of translating physical and transition risks into financial terms","The lack of corporate governance structures",C,"Quantifying climate-related financial risks is challenging because it involves assessing both physical risks..."
"Which of the following best describes ESG-themed ETFs?","Funds that exclude all non-ESG-compliant companies","Funds that invest in companies aligned with specific ESG themes","Funds that focus solely on governance factors","Funds that provide fixed returns regardless of market performance",B,"ESG-themed exchange-traded funds (ETFs) focus on particular sustainability or social themes..."
"How does the concept of circular economy align with ESG principles?","It promotes linear consumption patterns","It minimizes waste by emphasizing resource reuse and recycling","It focuses solely on renewable energy investments","It eliminates the need for biodiversity conservation",B,"The circular economy is a model that minimizes waste and maximizes resource efficiency..."
"What is the primary goal of climate adaptation strategies?","To reduce greenhouse gas emissions","To prepare for and mitigate the impacts of climate change","To phase out renewable energy sources","To prioritize short-term economic growth",B,"Climate adaptation strategies focus on preparing for and mitigating the impacts of climate change..."
"What is the focus of ESG disclosure frameworks like GRI and SASB?","To enforce penalties on non-compliant companies","To provide standardized guidelines for reporting ESG performance","To prioritize financial metrics over sustainability","To exclude companies from certain industries",B,"ESG disclosure frameworks such as the Global Reporting Initiative (GRI) and the Sustainability Accounting Standards Board (SASB)..."
"Why is water risk a critical consideration in ESG investing?","It affects only companies in water-intensive sectors","It is unrelated to climate change risks","It has significant implications for global supply chains and community well-being","It is solely a regulatory concern",C,"Water risk is a critical ESG factor because it affects industries dependent on water resources..."
"What is the key benefit of aligning investments with the UN Sustainable Development Goals (SDGs)?","It guarantees short-term financial returns","It provides a framework for addressing global challenges","It eliminates the need for ESG integration","It restricts investments to developed markets",B,"Aligning investments with the SDGs provides a comprehensive framework for addressing global challenges..."
"What is the purpose of ESG integration in fixed income investing?","To avoid all credit risk","To assess how ESG factors influence the creditworthiness of issuers","To eliminate the need for financial metrics","To focus exclusively on high-yield bonds",B,"ESG integration in fixed income investing involves evaluating how environmental, social, and governance factors affect an issuer's stability..."
"What distinguishes social impact bonds from traditional bonds?","They provide fixed returns regardless of performance","Their returns are linked to the achievement of specific social outcomes","They focus exclusively on environmental projects","They are only issued by governments",B,"Social impact bonds (SIBs) are financial instruments where returns are contingent on achieving predefined social outcomes..."
"Why are transition risks significant in ESG analysis?","They are irrelevant to corporate financial performance","They relate to changes in regulation, market preferences, and technology","They focus exclusively on biodiversity conservation","They apply only to companies in the energy sector",B,"Transition risks arise from changes in regulation, market preferences, and technology..."
"How does diversity and inclusion in the workplace contribute to ESG objectives?","It increases regulatory compliance costs","It enhances innovation, employee satisfaction, and company reputation","It focuses solely on gender equality","It eliminates the need for governance practices",B,"Diversity and inclusion foster innovation by bringing diverse perspectives..."
"What is the primary challenge in combating biodiversity loss through ESG investing?","The lack of investor interest","The complexity of measuring biodiversity impacts and outcomes","The absence of regulatory frameworks","The limited role of corporate governance",B,"Biodiversity loss is challenging to address because measuring its impacts and outcomes requires complex and site-specific data..."
"What role does supply chain transparency play in ESG investing?","It ensures compliance with all environmental regulations","It identifies risks such as labor violations and environmental degradation","It eliminates the need for stakeholder engagement","It focuses solely on financial performance",B,"Supply chain transparency helps investors identify ESG risks..."
"What is the impact of stranded assets on financial portfolios?","They enhance portfolio returns","They expose investors to financial risks from devalued assets","They guarantee long-term growth","They focus exclusively on fossil fuels",B,"Stranded assets are assets that lose value due to economic, regulatory, or technological changes..."
"What is the primary focus of the Science Based Targets initiative (SBTi)?","To enforce penalties for non-compliance","To guide companies in setting emissions reduction targets aligned with climate science","To prioritize short-term economic growth","To exclude specific industries from ESG investments",B,"The SBTi provides companies with a framework for setting emissions reduction targets..."