question,optionA,optionB,optionC,optionD,correctAnswer,explanation
"Among the enumerated options, which best exemplifies a financial commitment dedicated to promoting ecologically sustainable ventures, commonly referred to as 'green investments'?",Investing in coal mining operations,Allocating funds to renewable energy projects,Supporting deforestation activities,Financing tobacco production,B,"Green investments focus on mitigating environmental challenges, such as climate change, by allocating capital to renewable energy, pollution control, and energy efficiency initiatives."
"When implementing the triple bottom line (TBL) paradigm, which triadic dimensions are concurrently assessed to holistically gauge an organization's performance metrics?","Profit, productivity, and performance","People, planet, and profit","Resources, risks, and rewards","Efficiency, ethics, and equity",B,"TBL incorporates social, environmental, and financial considerations (people, planet, profit) to evaluate a company’s overall impact."
"Within the realm of socially responsible finance, which principal objective characterizes the practice of impact investing, emphasizing returns alongside societal benefits?",Maximizing short-term profits,Addressing societal challenges alongside financial returns,Avoiding regulatory compliance,Investing solely in developed markets,B,"Impact investing aims to generate measurable positive social or environmental outcomes alongside financial returns."
"Per the Stockholm Resilience Centre's framework, which two principal planetary boundaries are deemed indispensable for preserving Earth's systemic equilibrium?",Ocean acidification and land-system change,Climate change and biosphere integrity,Freshwater use and atmospheric aerosol loading,Deforestation and novel entities,B,"Climate change and biosphere integrity are considered core boundaries as they are crucial to maintaining Earth’s stability."
"Which investment methodology employs socially and ecologically driven screens to determine corporate eligibility within a portfolio context?",Thematic investing,Best-in-class investing,Socially responsible investing (SRI),Green investing,C,"SRI involves using social and environmental criteria to evaluate and exclude companies from the investment universe."
"Identify the framework that concurrently accounts for both monetary repercussions and broader societal or ecological consequences in evaluating ESG elements.",Fiduciary duty,Double materiality,Dynamic materiality,Resource nationalism,B,"Double materiality considers how ESG factors impact a company’s financial performance and how the company impacts society and the environment."
"Which principal advantage emerges from systematically embedding ESG considerations into investment analyses and portfolio decision-making?",Higher portfolio diversification,Reduced negative externalities,Increased regulatory risks,Focus on short-term financial gains,B,"ESG integration reduces risks, such as fines or externalities, while benefiting from sustainability megatrends."
"Which approach within ESG investing hinges on proactive engagement and dialogue with portfolio companies to steer corporate conduct?",Negative screening,Shareholder engagement,Social impact bonds,Thematic investing,B,"Shareholder engagement entails active ownership, where investors influence companies' decisions on ESG matters through dialogue or voting."
"Out of the enumerated options, which typifies a capital allocation strategy primarily intended to address social challenges in tandem with financial returns?",Microfinance bonds,Smart grids,Low-carbon vehicles,Pollution control technologies,A,"Social investments address societal challenges like poverty or healthcare, often targeting the bottom of the economic pyramid (BOP)."
"Which listed option exemplifies a thematic investment strategy, wherein capital is directed toward overarching sustainability or social themes?",Investing in companies based on sector benchmarks,Targeting funds for low-carbon energy or water access,Avoiding investments in sin stocks,Focusing solely on short-term returns,B,"Thematic investing focuses on needs arising from environmental or social challenges, such as access to clean water or renewable energy."
"Which statement accurately characterizes the 'best-in-class' approach, wherein companies with superior ESG metrics are selected from each industry cohort?",Avoiding all high-risk sectors,Selecting companies with top ESG scores within each sector,Only investing in green bonds,Targeting companies with low returns but high impact,B,"Best-in-class investing selects the highest-ranking companies on ESG factors within each sector or industry."
"Which principal tenet underlies ethical or faith-based investing, entailing asset selection aligned with moral or religious precepts?",Excluding sin stocks like tobacco and alcohol,Targeting renewable energy investments,Maximizing financial returns,Promoting high-carbon energy sources,A,"Ethical investing screens out industries considered morally or religiously objectionable, such as alcohol, gambling, and weapons."
"Identify the term denoting investment activities that harmonize with collective societal objectives and moral principles, commonly through ESG screening?",Impact investing,Sustainable investing,Responsible investing,Socially responsible investing,D,"Socially responsible investing aligns capital allocation with societal and environmental values through ESG screening."
"In economic terms, which option exemplifies a detrimental spillover effect not fully borne by the entity generating it, thereby imposing costs on third parties?",Reduced pollution,Increased tourism revenues,Air pollution from manufacturing,Improved employee satisfaction,C,"Negative externalities occur when private costs are lower than societal costs, such as pollution harming public health."
"Within the context of ESG-oriented portfolio management, what does the modern interpretation of fiduciary duty encompass regarding risk and return considerations?",Avoiding ESG factors to focus on financial returns,Integrating ESG considerations to protect long-term value,Excluding all high-risk industries,Prioritizing short-term gains,B,"Modern interpretations of fiduciary duty require incorporating ESG factors to manage long-term risks and returns."
"In the domain of sustainable finance, which tripartite constellation of dimensions is encapsulated by the abbreviation ESG, guiding investment evaluations?","Economic, societal, and governance","Environmental, social, and governance","Ethical, sustainable, and governance","Equity, social, and growth",B,"ESG factors encompass environmental, social, and governance considerations for sustainable and responsible investing."
"Which methodology seeks to reconcile profitable outcomes with quantifiable societal benefits in an investment framework?",Negative screening,Venture philanthropy,Impact investing,Thematic investing,C,"Impact investing aims to achieve financial returns while addressing social or environmental challenges."
"Which defining attribute pertains to dynamic materiality, acknowledging the shifting relevance of ESG factors over time and context?",ESG factors remain static over time,ESG risks evolve and change in importance,Only social factors are prioritized,Governance issues are ignored,B,"Dynamic materiality recognizes that ESG factors and their financial relevance can evolve based on new developments or trends."
"Which listed action constitutes the exclusion of specific sectors or firms from an investment portfolio based on ethical or ESG criteria?",Excluding tobacco companies from a portfolio,Investing in renewable energy,Targeting top ESG-rated companies in each sector,Allocating funds to microfinance initiatives,A,"Negative screening involves excluding companies or sectors that conflict with specific ethical or moral standards."
"Which overarching objective typifies sustainable investing, seeking to reconcile resource stewardship with viable long-term returns?",Avoiding all risky investments,Focusing only on environmental outcomes,Contributing to a sustainable economy while achieving returns,Maximizing short-term returns,C,"Sustainable investing supports economic activities that minimize resource depletion and maximize long-term returns."
"Which category of ESG-oriented endeavors focuses on addressing large-scale systemic challenges, such as anthropogenic climate disruption?",Socially responsible investing,Supranational initiatives,Negative screening,Shareholder activism,B,"Supranational ESG initiatives focus on global challenges like climate change and biodiversity loss, promoting collective action."
"Identify the principal aim of social investment, wherein capital is directed toward mitigating societal issues such as poverty or inadequate healthcare?",Reducing carbon emissions,Addressing social challenges like poverty or healthcare,Promoting fossil fuel usage,Excluding sin stocks,B,"Social investments allocate capital to address issues like healthcare, poverty, and education, often targeting underserved populations."
"Which set of activities characterizes shareholder engagement, an ESG mechanism through which investors actively influence corporate practices?",Passive ownership of companies,Voting and dialogue to influence corporate ESG practices,Avoiding all controversial industries,Divesting from companies with low returns,B,"Shareholder engagement uses active ownership strategies, such as voting and dialogue, to influence ESG-related decisions."
"Select the option that epitomizes a thematic investment strategy, wherein funding converges on addressing a specific environmental or social theme?",Investing in energy efficiency technologies,Avoiding high-carbon sectors,Allocating funds to coal-based power plants,Only investing in large-cap companies,A,"Thematic investing targets specific trends or challenges, such as energy efficiency or access to clean water."
"Which outcome is commonly observed when ESG considerations are thoroughly interwoven into standard investment processes?",Increased regulatory risks,Enhanced ability to benefit from sustainability megatrends,Avoidance of long-term planning,Focus on short-term returns,B,"ESG integration considers long-term risks and opportunities, enhancing the potential to benefit from sustainability megatrends."
"Which factor poses a significant obstacle to effectively embedding ESG considerations into investment decisions, reflecting the complexities of measurement or data availability?","Lack of regulatory support","Overreliance on financial metrics","Difficulty in quantifying ESG risks","Absence of financial institutions interested in ESG","C","One of the biggest challenges in ESG integration is quantifying ESG risks and understanding their material impact on financial performance..."
"Which objective does double materiality serve in ESG finance, emphasizing both financial repercussions and the broader societal impact of corporate operations?","To prioritize shareholder returns over societal benefits","To evaluate both financial and societal impacts of a company's actions","To focus solely on financial materiality for investment decisions","To minimize investment in emerging markets","B","Double materiality acknowledges two dimensions: financial materiality and societal materiality..."
"Which facet distinguishes dynamic materiality from a static model, reflecting the evolving significance of ESG factors over time and shifting market conditions?","It assumes that ESG factors are irrelevant over time","It considers the evolving importance of ESG factors due to changing trends","It focuses exclusively on environmental factors","It treats all ESG factors as permanently fixed","B","Dynamic materiality recognizes that the relevance of ESG factors can shift over time..."
"In ESG discourse, which characterization accurately defines stranded assets, referencing holdings rendered obsolete by policy, technological, or market changes?","Assets that are undervalued in financial markets","Assets that lose value due to changes in policy, technology, or market demand","Assets that generate high financial returns with minimal ESG considerations","Assets with long-term growth potential in emerging markets","B","Stranded assets are those that lose value or become obsolete due to shifts in policy, technology, or market preferences..."
"Which overarching role does the TCFD fulfill in ESG reporting, particularly regarding transparency around climate-associated financial risks and opportunities?","It mandates carbon neutrality for all companies by 2030","It provides a framework for companies to disclose climate-related financial risks","It focuses exclusively on reporting social and governance factors","It penalizes companies with inadequate ESG practices","B","The TCFD was established to enhance transparency around climate-related financial risks and opportunities..."
"Which defining aspect sets green bonds apart from traditional debt instruments, highlighting their environmentally targeted deployment of capital proceeds?","They offer higher interest rates than conventional bonds","Their proceeds are exclusively allocated to environmentally beneficial projects","They carry no financial risk for investors","They are only available to institutional investors","B","Green bonds are financial instruments designed to raise capital for projects that deliver environmental benefits..."
"Which fundamental shortcoming often plagues ESG rating systems, leading to inconsistencies and potential confusion among investors?","They provide excessive transparency to investors","They lack consistency across different rating agencies","They focus exclusively on financial performance","They disregard governance considerations","B","A key limitation of ESG ratings is the lack of standardization across rating agencies..."
"Which scenario illustrates the principle of a just transition, ensuring that the shift toward a low-carbon economy remains equitable for affected workers and communities?","Accelerating the energy transition without regard for displaced workers","Ensuring that the transition to a low-carbon economy is equitable and inclusive","Prioritizing corporate profits over social equity during the energy transition","Restricting renewable energy investments to developed countries","B","A just transition aims to ensure that the shift to a low-carbon economy is socially inclusive..."
"Which primary differentiator sets impact investing apart from standard ESG approaches, particularly regarding explicit social or environmental outcomes?","Impact investing explicitly aims for measurable social or environmental outcomes","Impact investing avoids all high-risk investments","Impact investing focuses solely on governance factors","Impact investing disregards financial returns","A","While traditional ESG investing considers environmental, social, and governance factors..."
"In the domain of responsible investing, which function is served by stewardship, entailing the proactive oversight and engagement with portfolio entities?","Passive ownership of companies in ESG portfolios","Active engagement with companies to influence ESG practices","Avoidance of all ESG risks in investment decisions","Divestment from companies with low ESG ratings","B","Stewardship involves active ownership, where investors engage with companies to encourage better ESG practices..."
"Within ESG paradigms, how does shareholder activism operationalize investor influence to prompt corporate improvements in sustainability or governance?","Divesting from non-compliant companies","Pressuring companies to improve ESG practices through voting and resolutions","Avoiding all controversial sectors","Focusing only on financial returns","B","Shareholder activism focuses on influencing corporate behavior through actions such as submitting shareholder proposals..."
"Which aspect delineates sustainability-linked bonds from conventional green bonds, particularly regarding performance targets and coupon adjustments?","They have fixed interest rates regardless of performance","They penalize companies for failing to meet specific ESG targets","They focus exclusively on renewable energy projects","They are only issued by governments","B","Sustainability-linked bonds differ from green bonds in that their financial characteristics are tied..."
"Which core purpose does the EU Taxonomy fulfill, shaping the classification of economic undertakings as truly sustainable and mitigating greenwashing concerns?","To impose penalties on non-compliant companies","To establish a unified classification system for sustainable investments","To prioritize financial returns over ESG factors","To exclude emerging markets from ESG initiatives","B","The EU Taxonomy provides a standardized framework to identify which economic activities qualify as environmentally sustainable..."
"Which rationale supports the designation of biodiversity depletion as a systemic risk, reflecting its broad ramifications for economic stability and ecosystem services?",It has minimal impact on financial markets,It only affects emerging economies,It disrupts ecosystems critical for economic stability and human well-being,It is easily mitigated by technology alone,C,"Biodiversity loss is a systemic risk because it threatens the ecosystems that underpin economic activities..."
"Which function do carbon offset initiatives serve, enabling entities to compensate for greenhouse gas emissions through equivalent reductions elsewhere?",To reduce emissions at the source,To compensate for emissions by funding equivalent carbon savings,To prioritize fossil fuel usage,To eliminate the need for renewable energy,B,"Carbon offset programs allow organizations to compensate for their greenhouse gas emissions..."
"How has modern fiduciary doctrine evolved to intersect with the incorporation of ESG variables in portfolio management?","They are unrelated concepts","ESG integration conflicts with fiduciary duty","ESG integration is increasingly seen as part of fiduciary duty","Fiduciary duty requires ignoring ESG considerations",C,"Fiduciary duty traditionally focused on financial returns, but modern interpretations increasingly recognize that ESG factors can have material impacts..."
"Which approach utilizes ecological processes to tackle environmental challenges, aligning with ESG goals through habitat restoration or resource management?","Technological interventions to replace natural systems","Strategies that use natural processes to address environmental challenges","Economic measures to phase out nature-related investments","Policies aimed solely at wildlife conservation",B,"Nature-based solutions leverage natural processes to address challenges such as climate change, biodiversity loss, and water management."
"What is the significance of maintaining a 'social license to operate,' reflecting public and stakeholder acceptance of a firm's activities?","It ensures compliance with government regulations","It reflects public and stakeholder acceptance of a company's operations","It guarantees financial success in all industries","It eliminates the need for ESG reporting",B,"Social license to operate refers to the informal approval granted by communities and stakeholders..."
"Which key feature differentiates superficial environmental claims (greenwashing) from authentically substantiated ESG practices?","Greenwashing involves intentional misrepresentation of ESG practices","Greenwashing always leads to financial penalties","Greenwashing focuses exclusively on governance issues","Greenwashing is required to meet regulatory standards",A,"Greenwashing refers to the practice of misleading stakeholders..."
"What function do proxy voting guidelines serve in enabling investors to channel their ESG preferences through shareholder resolutions and corporate ballots?","They dictate how fund managers vote on shareholder resolutions","They restrict companies from issuing ESG-related disclosures","They eliminate the need for active engagement with companies","They allow investors to divest from low-performing companies",A,"Proxy voting policies guide how fund managers vote on shareholder resolutions, particularly on ESG-related issues."
"Which impediment most critically complicates the task of measuring how climate change phenomena translate into fiscal exposures and uncertainties?","Limited investor interest in climate risks","The absence of regulatory requirements","The complexity of translating physical and transition risks into financial terms","The lack of corporate governance structures",C,"Quantifying climate-related financial risks is challenging because it involves both physical risks and transition risks..."
"Which definition accurately captures the nature of ESG-themed exchange-traded funds, focusing on specific sustainability motifs or social imperatives?","Funds that exclude all non-ESG-compliant companies","Funds that invest in companies aligned with specific ESG themes","Funds that focus solely on governance factors","Funds that provide fixed returns regardless of market performance",B,"ESG-themed ETFs focus on particular sustainability or social themes..."
"Which aspect of the circular economy model resonates with ESG benchmarks, advocating for extended product lifecycles and waste minimization?","It promotes linear consumption patterns","It minimizes waste by emphasizing resource reuse and recycling","It focuses exclusively on renewable energy investments","It eliminates the need for biodiversity conservation",B,"The circular economy is a model that minimizes waste and maximizes resource efficiency..."
"Which principal aim underlies climate adaptation measures, seeking to enhance resilience against the multifaceted impacts of global warming?","To reduce greenhouse gas emissions","To prepare for and mitigate the impacts of climate change","To phase out renewable energy sources","To prioritize short-term economic growth",B,"Climate adaptation strategies focus on preparing for and mitigating the impacts of climate change..."
"What collective purpose do standards such as GRI and SASB serve, ensuring consistent and transparent reporting of ESG-related data for stakeholders?","To enforce penalties on non-compliant companies","To provide standardized guidelines for reporting ESG performance","To prioritize financial metrics over sustainability","To exclude companies from certain industries",B,"ESG disclosure frameworks such as GRI and SASB provide standardized guidelines for companies to report their ESG performance..."
"Which factors render water scarcity and related pressures a pivotal concern for ESG-minded investors across diverse supply chains and sectors?","It affects only companies in water-intensive sectors","It is unrelated to climate change risks","It has significant implications for global supply chains and community well-being","It is solely a regulatory concern",C,"Water risk is a critical ESG factor because it affects industries dependent on water resources..."
"Identify the principal advantage of orienting portfolio allocations toward the SDGs, reflecting global priorities for social and environmental progress?","It guarantees short-term financial returns","It provides a framework for addressing global challenges","It eliminates the need for ESG integration","It restricts investments to developed markets",B,"Aligning investments with the SDGs provides a comprehensive framework for addressing global challenges..."
"Which rationale drives the incorporation of ESG factors into fixed-income analysis, assessing potential risks and opportunities for issuers' creditworthiness?","To avoid all credit risk","To assess how ESG factors influence the creditworthiness of issuers","To eliminate the need for financial metrics","To focus exclusively on high-yield bonds",B,"ESG integration in fixed income investing involves evaluating how environmental, social, and governance factors affect an issuer's stability..."
"Which defining characteristic sets social impact bonds apart, tying investor returns to the achievement of predetermined social outcomes?","They provide fixed returns regardless of performance","Their returns are linked to the achievement of specific social outcomes","They focus exclusively on environmental projects","They are only issued by governments",B,"Social impact bonds (SIBs) are financial instruments where returns are contingent on achieving predefined social outcomes..."
"Which reasons illustrate the importance of evaluating transition risks, encompassing regulatory, market, and technological upheavals in the move toward sustainability?","They are irrelevant to corporate financial performance","They relate to changes in regulation, market preferences, and technology","They focus exclusively on biodiversity conservation","They apply only to companies in the energy sector",B,"Transition risks arise from changes in regulation, market preferences, and technology..."
"Which positive outcomes arise from fostering workplace diversity and inclusion, aligning with the broader ESG mandate for social equity and robust governance?","It increases regulatory compliance costs","It enhances innovation, employee satisfaction, and company reputation","It focuses solely on gender equality","It eliminates the need for governance practices",B,"Diversity and inclusion foster innovation by bringing diverse perspectives to problem-solving..."
